{
  "command": "extract",
  "entries": [
    {
      "categories": [
        "documents"
      ],
      "extracted_path": "<ROOT>/extract-out/evidence/case-notes.txt",
      "modified_at": "2024-03-04T05:06:07+00:00",
      "original_path": "<ROOT>/evidence/case-notes.txt",
      "recovery": {
        "boundary_method": null,
        "candidate_kind": "existing",
        "commercial_claim_allowed": false,
        "confidence": "high",
        "deletion_state": "unknown",
        "limitations": [
          "Allocated filesystem object observed during scan; byte-level content integrity is not verified unless a hash profile ran."
        ],
        "reportability": "triage",
        "schema": "candidate-kind-v1",
        "signature_type": null,
        "source_id": "filesystem-scan",
        "source_offset": null,
        "source_path": "<ROOT>/evidence/case-notes.txt",
        "source_record_id": null,
        "subtype": null,
        "validation_status": "unverified"
      },
      "relative_path": "evidence/case-notes.txt",
      "sha256": "13fd9f7e491a17ad2e440993c72a592d161421eb59b37c1fcfe99c0bcc5b9dc0",
      "size": 14
    }
  ],
  "filters": {
    "categories": [
      "documents"
    ],
    "extensions": [
      ".txt"
    ],
    "kinds": [],
    "limit": 0,
    "name_contains": [],
    "path_contains": []
  },
  "generated_at": "<GENERATED_AT>",
  "input_json": "<ROOT>/rapidtriage-files.json",
  "output_dir": "<ROOT>/extract-out",
  "root": "<ROOT>",
  "safety": {
    "dry_run": false,
    "max_extract_size_bytes": 0,
    "max_file_count": 0,
    "overwrite": false,
    "read_only": false
  },
  "skipped": [],
  "source_command": "files",
  "summary": {
    "extracted_count": 1,
    "input_count": 2,
    "selected_count": 1,
    "skipped_count": 0
  }
}
